{
  "$schema": "http://json-schema.org/draft-04/schema#",
  "id": "disease_burden",
  "title": "Disease burden",
  "type": "object",
  "namespace": "urn:nmmi:lu177-psma:model",
  "category": "clinical",
  "program": "*",
  "project": "*",
  "description": "Patient- or compartment-level quantitative imaging summary derived from a specified examination and included lesions.",
  "additionalProperties": false,
  "submittable": true,
  "validators": null,
  "links": [
    {
      "name": "cases",
      "backref": "nmmi_disease_burden_cases",
      "label": "belongs_to",
      "target_type": "case",
      "multiplicity": "many_to_one",
      "required": true
    },
    {
      "name": "imaging_studies",
      "backref": "nmmi_disease_burden_imaging_studies",
      "label": "derived_from",
      "target_type": "imaging_study",
      "multiplicity": "many_to_one",
      "required": true
    },
    {
      "name": "included_targets",
      "backref": "nmmi_disease_burden_included_targets",
      "label": "derived_from",
      "target_type": "anatomic_target",
      "multiplicity": "many_to_many",
      "required": false
    },
    {
      "name": "provenance_records",
      "backref": "nmmi_disease_burden_provenance_records",
      "label": "documented_by",
      "target_type": "provenance",
      "multiplicity": "many_to_many",
      "required": false
    },
    {
      "name": "roi_measurements",
      "target_type": "measurement",
      "backref": "nmmi_disease_burden_roi_measurements",
      "label": "related_to",
      "multiplicity": "many_to_many",
      "required": false
    }
  ],
  "required": [
    "type",
    "submitter_id",
    "cases",
    "imaging_studies",
    "scope",
    "total_psma_positive_tumor_volume_ml",
    "method"
  ],
  "uniqueKeys": [
    [
      "id"
    ],
    [
      "project_id",
      "submitter_id"
    ]
  ],
  "systemProperties": [
    "id",
    "project_id",
    "state",
    "created_datetime",
    "updated_datetime"
  ],
  "properties": {
    "type": {
      "enum": [
        "disease_burden"
      ]
    },
    "submitter_id": {
      "type": "string",
      "description": "Stable submitter-assigned identifier, unique within a project. Do not encode direct patient identifiers.",
      "minLength": 1
    },
    "model_version": {
      "type": "string",
      "description": "Version of the submitting theranostics extension, independently of the MIDRC baseline version."
    },
    "record_status": {
      "type": "string",
      "description": "Record curation state, independent of clinical value.",
      "enum": [
        "draft",
        "reviewed",
        "approved",
        "superseded",
        "withdrawn"
      ]
    },
    "source_record_id": {
      "type": "string",
      "description": "Identifier of the originating source record; use an approved pseudonym when needed."
    },
    "source_system": {
      "type": "string",
      "description": "Source system or data provider."
    },
    "missing_properties": {
      "type": "array",
      "description": "Names of properties missing from this record; no missing value is encoded as zero.",
      "items": {
        "type": "string"
      }
    },
    "missing_reasons": {
      "type": "array",
      "description": "Reasons corresponding by index to missing_properties.",
      "items": {
        "enum": [
          "unknown",
          "not_collected",
          "not_applicable",
          "not_available",
          "withheld",
          "pending"
        ]
      }
    },
    "assessment_datetime": {
      "type": "string",
      "description": "ISO 8601 assessment datetime; use approved date shifting consistently within the case.",
      "format": "date-time"
    },
    "days_from_course_start": {
      "type": "number",
      "description": "Signed elapsed days from the linked therapy course start."
    },
    "time_basis": {
      "type": "string",
      "description": "Interpretation of stored dates and elapsed times.",
      "enum": [
        "actual",
        "shifted",
        "relative_only",
        "unknown"
      ]
    },
    "time_window_start_day": {
      "type": "number",
      "description": "Beginning of assessment window relative to course start, in days."
    },
    "time_window_end_day": {
      "type": "number",
      "description": "End of assessment window relative to course start, in days."
    },
    "id": {
      "pattern": "^[a-fA-F0-9]{8}-[a-fA-F0-9]{4}-[a-fA-F0-9]{4}-[a-fA-F0-9]{4}-[a-fA-F0-9]{12}$",
      "systemAlias": "node_id",
      "term": {
        "description": "A 128-bit identifier. Depending on the mechanism used to generate it, it is either guaranteed to be different from all other UUIDs/GUIDs generated until 3400 AD or extremely likely to be different. Its relatively small size lends itself well to sorting, ordering, and hashing of all sorts, storing in databases, simple allocation, and ease of programming in general.\n",
        "termDef": {
          "cde_id": "C54100",
          "cde_version": null,
          "source": "NCIt",
          "term": "Universally Unique Identifier",
          "term_url": "https://ncit.nci.nih.gov/ncitbrowser/ConceptReport.jsp?dictionary=NCI_Thesaurus&version=16.02d&ns=NCI_Thesaurus&code=C54100"
        }
      },
      "type": "string"
    },
    "project_id": {
      "term": {
        "description": "Unique ID for any specific defined piece of work that is undertaken or attempted to meet a single requirement.\n"
      },
      "type": "string"
    },
    "state": {
      "default": "validated",
      "downloadable": [
        "uploaded",
        "md5summed",
        "validating",
        "validated",
        "error",
        "invalid",
        "released"
      ],
      "oneOf": [
        {
          "enum": [
            "uploading",
            "uploaded",
            "md5summing",
            "md5summed",
            "validating",
            "error",
            "invalid",
            "suppressed",
            "redacted",
            "live"
          ]
        },
        {
          "enum": [
            "validated",
            "submitted",
            "released"
          ]
        }
      ],
      "public": [
        "live"
      ],
      "term": {
        "description": "The current state of the object.\n"
      }
    },
    "created_datetime": {
      "oneOf": [
        {
          "format": "date-time",
          "type": "string"
        },
        {
          "type": "null"
        }
      ],
      "term": {
        "description": "A combination of date and time of day in the form [-]CCYY-MM-DDThh:mm:ss[Z|(+|-)hh:mm]\n"
      }
    },
    "updated_datetime": {
      "oneOf": [
        {
          "format": "date-time",
          "type": "string"
        },
        {
          "type": "null"
        }
      ],
      "term": {
        "description": "A combination of date and time of day in the form [-]CCYY-MM-DDThh:mm:ss[Z|(+|-)hh:mm]\n"
      }
    },
    "cases": {
      "type": "array",
      "items": {
        "type": "object",
        "additionalProperties": false,
        "properties": {
          "submitter_id": {
            "type": "string",
            "minLength": 1
          },
          "id": {
            "pattern": "^[a-fA-F0-9]{8}-[a-fA-F0-9]{4}-[a-fA-F0-9]{4}-[a-fA-F0-9]{4}-[a-fA-F0-9]{12}$",
            "systemAlias": "node_id",
            "term": {
              "description": "A 128-bit identifier. Depending on the mechanism used to generate it, it is either guaranteed to be different from all other UUIDs/GUIDs generated until 3400 AD or extremely likely to be different. Its relatively small size lends itself well to sorting, ordering, and hashing of all sorts, storing in databases, simple allocation, and ease of programming in general.\n",
              "termDef": {
                "cde_id": "C54100",
                "cde_version": null,
                "source": "NCIt",
                "term": "Universally Unique Identifier",
                "term_url": "https://ncit.nci.nih.gov/ncitbrowser/ConceptReport.jsp?dictionary=NCI_Thesaurus&version=16.02d&ns=NCI_Thesaurus&code=C54100"
              }
            },
            "type": "string"
          }
        },
        "oneOf": [
          {
            "required": [
              "submitter_id"
            ]
          },
          {
            "required": [
              "id"
            ]
          }
        ]
      },
      "uniqueItems": true,
      "description": "References to case records.",
      "minItems": 1,
      "maxItems": 1
    },
    "imaging_studies": {
      "type": "array",
      "items": {
        "type": "object",
        "additionalProperties": false,
        "properties": {
          "submitter_id": {
            "type": "string",
            "minLength": 1
          },
          "id": {
            "pattern": "^[a-fA-F0-9]{8}-[a-fA-F0-9]{4}-[a-fA-F0-9]{4}-[a-fA-F0-9]{4}-[a-fA-F0-9]{12}$",
            "systemAlias": "node_id",
            "term": {
              "description": "A 128-bit identifier. Depending on the mechanism used to generate it, it is either guaranteed to be different from all other UUIDs/GUIDs generated until 3400 AD or extremely likely to be different. Its relatively small size lends itself well to sorting, ordering, and hashing of all sorts, storing in databases, simple allocation, and ease of programming in general.\n",
              "termDef": {
                "cde_id": "C54100",
                "cde_version": null,
                "source": "NCIt",
                "term": "Universally Unique Identifier",
                "term_url": "https://ncit.nci.nih.gov/ncitbrowser/ConceptReport.jsp?dictionary=NCI_Thesaurus&version=16.02d&ns=NCI_Thesaurus&code=C54100"
              }
            },
            "type": "string"
          }
        },
        "oneOf": [
          {
            "required": [
              "submitter_id"
            ]
          },
          {
            "required": [
              "id"
            ]
          }
        ]
      },
      "uniqueItems": true,
      "description": "References to imaging_study records.",
      "minItems": 1,
      "maxItems": 1
    },
    "included_targets": {
      "type": "array",
      "items": {
        "type": "object",
        "additionalProperties": false,
        "properties": {
          "submitter_id": {
            "type": "string",
            "minLength": 1
          },
          "id": {
            "pattern": "^[a-fA-F0-9]{8}-[a-fA-F0-9]{4}-[a-fA-F0-9]{4}-[a-fA-F0-9]{4}-[a-fA-F0-9]{12}$",
            "systemAlias": "node_id",
            "term": {
              "description": "A 128-bit identifier. Depending on the mechanism used to generate it, it is either guaranteed to be different from all other UUIDs/GUIDs generated until 3400 AD or extremely likely to be different. Its relatively small size lends itself well to sorting, ordering, and hashing of all sorts, storing in databases, simple allocation, and ease of programming in general.\n",
              "termDef": {
                "cde_id": "C54100",
                "cde_version": null,
                "source": "NCIt",
                "term": "Universally Unique Identifier",
                "term_url": "https://ncit.nci.nih.gov/ncitbrowser/ConceptReport.jsp?dictionary=NCI_Thesaurus&version=16.02d&ns=NCI_Thesaurus&code=C54100"
              }
            },
            "type": "string"
          }
        },
        "oneOf": [
          {
            "required": [
              "submitter_id"
            ]
          },
          {
            "required": [
              "id"
            ]
          }
        ]
      },
      "uniqueItems": true,
      "description": "References to anatomic_target records."
    },
    "provenance_records": {
      "type": "array",
      "items": {
        "type": "object",
        "additionalProperties": false,
        "properties": {
          "submitter_id": {
            "type": "string",
            "minLength": 1
          },
          "id": {
            "pattern": "^[a-fA-F0-9]{8}-[a-fA-F0-9]{4}-[a-fA-F0-9]{4}-[a-fA-F0-9]{4}-[a-fA-F0-9]{12}$",
            "systemAlias": "node_id",
            "term": {
              "description": "A 128-bit identifier. Depending on the mechanism used to generate it, it is either guaranteed to be different from all other UUIDs/GUIDs generated until 3400 AD or extremely likely to be different. Its relatively small size lends itself well to sorting, ordering, and hashing of all sorts, storing in databases, simple allocation, and ease of programming in general.\n",
              "termDef": {
                "cde_id": "C54100",
                "cde_version": null,
                "source": "NCIt",
                "term": "Universally Unique Identifier",
                "term_url": "https://ncit.nci.nih.gov/ncitbrowser/ConceptReport.jsp?dictionary=NCI_Thesaurus&version=16.02d&ns=NCI_Thesaurus&code=C54100"
              }
            },
            "type": "string"
          }
        },
        "oneOf": [
          {
            "required": [
              "submitter_id"
            ]
          },
          {
            "required": [
              "id"
            ]
          }
        ]
      },
      "uniqueItems": true,
      "description": "References to provenance records."
    },
    "scope": {
      "type": "string",
      "description": "Anatomic coverage of the summary. Whole-body PTLV must not be substituted by a single index-lesion volume.",
      "enum": [
        "whole_body",
        "compartment",
        "selected_lesions"
      ]
    },
    "total_psma_positive_tumor_volume_ml": {
      "type": "number",
      "description": "Total segmented PSMA-positive tumor volume in the stated scope at this examination.",
      "minimum": 0
    },
    "method": {
      "type": "string",
      "description": "Imaging-burden method."
    },
    "software_version": {
      "type": "string",
      "description": "Imaging-burden software version."
    },
    "coverage_description": {
      "type": "string",
      "description": "Imaging-burden coverage description."
    },
    "exclusions": {
      "type": "string",
      "description": "Imaging-burden exclusions."
    },
    "compartment": {
      "type": "string",
      "description": "Imaging-burden compartment."
    },
    "lesion_count": {
      "type": "integer",
      "description": "Number of included PSMA-positive lesions.",
      "minimum": 0
    },
    "assessment_role": {
      "type": "string",
      "description": "Baseline, interim, end-of-treatment or follow-up scan role."
    },
    "roi_measurements": {
      "anyOf": [
        {
          "type": "object",
          "additionalProperties": false,
          "properties": {
            "submitter_id": {
              "type": "string",
              "minLength": 1
            },
            "id": {
              "pattern": "^[a-fA-F0-9]{8}-[a-fA-F0-9]{4}-[a-fA-F0-9]{4}-[a-fA-F0-9]{4}-[a-fA-F0-9]{12}$",
              "term": {
                "description": "A 128-bit identifier. Depending on the mechanism used to generate it, it is either guaranteed to be different from all other UUIDs/GUIDs generated until 3400 AD or extremely likely to be different. Its relatively small size lends itself well to sorting, ordering, and hashing of all sorts, storing in databases, simple allocation, and ease of programming in general.\n",
                "termDef": {
                  "cde_id": "C54100",
                  "cde_version": null,
                  "source": "NCIt",
                  "term": "Universally Unique Identifier",
                  "term_url": "https://ncit.nci.nih.gov/ncitbrowser/ConceptReport.jsp?dictionary=NCI_Thesaurus&version=16.02d&ns=NCI_Thesaurus&code=C54100"
                }
              },
              "type": "string"
            }
          },
          "anyOf": [
            {
              "required": [
                "submitter_id"
              ]
            },
            {
              "required": [
                "id"
              ]
            }
          ]
        },
        {
          "type": "array",
          "items": {
            "type": "object",
            "additionalProperties": false,
            "properties": {
              "submitter_id": {
                "type": "string",
                "minLength": 1
              },
              "id": {
                "pattern": "^[a-fA-F0-9]{8}-[a-fA-F0-9]{4}-[a-fA-F0-9]{4}-[a-fA-F0-9]{4}-[a-fA-F0-9]{12}$",
                "term": {
                  "description": "A 128-bit identifier. Depending on the mechanism used to generate it, it is either guaranteed to be different from all other UUIDs/GUIDs generated until 3400 AD or extremely likely to be different. Its relatively small size lends itself well to sorting, ordering, and hashing of all sorts, storing in databases, simple allocation, and ease of programming in general.\n",
                  "termDef": {
                    "cde_id": "C54100",
                    "cde_version": null,
                    "source": "NCIt",
                    "term": "Universally Unique Identifier",
                    "term_url": "https://ncit.nci.nih.gov/ncitbrowser/ConceptReport.jsp?dictionary=NCI_Thesaurus&version=16.02d&ns=NCI_Thesaurus&code=C54100"
                  }
                },
                "type": "string"
              }
            },
            "anyOf": [
              {
                "required": [
                  "submitter_id"
                ]
              },
              {
                "required": [
                  "id"
                ]
              }
            ]
          },
          "minItems": 1
        }
      ]
    }
  }
}
